Book,Exam,Number,ID,Subject,Topic,Question,OptionA,OptionB,OptionC,OptionD,OptionE,CorrectAnswer,Explanation
,,,,Cell Physiology (BRS),Membrane Transport,Which of the following describes simple diffusion?,"No carrier needed, passive, downhill","Needs carrier, passive, downhill","Needs ATP, uphill","Uses energy from primary pump, uphill","Active, uses carrier","No carrier needed, passive, downhill","<span style=""color:green""><b>[No carrier needed, passive, downhill]:</b> Correct, simple diffusion is defined as passive movement downhill without a carrier.</span><br><span style=""color:red""><b>[Needs carrier, passive, downhill]:</b> Wrong, this describes facilitated diffusion.</span><br><span style=""color:red""><b>[Needs ATP, uphill]:</b> Wrong, this describes primary active transport.</span><br><span style=""color:red""><b>[Uses energy from primary pump, uphill]:</b> Wrong, this describes secondary active transport.</span><br><span style=""color:red""><b>[Active, uses carrier]:</b> Wrong, simple diffusion is a passive process.</span>"
,,,,Cell Physiology (BRS),Membrane Transport,What is the direction of transport in simple diffusion?,Uphill (against gradient),Downhill (follows electrochemical gradient),Horizontal across membrane,Unidirectional only,Bidirectional against gradient,Downhill (follows electrochemical gradient),"<span style=""color:green""><b>[Downhill (follows electrochemical gradient)]:</b> Correct, the text states simple diffusion follows the electrochemical gradient.</span><br><span style=""color:red""><b>[Uphill (against gradient)]:</b> Wrong, uphill movement requires energy and is characteristic of active transport.</span><br><span style=""color:red""><b>[Horizontal across membrane]:</b> Wrong, the text specifies the direction as <i>downhill</i>.</span><br><span style=""color:red""><b>[Unidirectional only]:</b> Wrong, the direction is dictated by the electrochemical gradient.</span><br><span style=""color:red""><b>[Bidirectional against gradient]:</b> Wrong, simple diffusion cannot go against a gradient.</span>"
,,,,Cell Physiology (BRS),Membrane Transport,Which characteristic distinguishes facilitated diffusion from simple diffusion?,It requires energy (ATP),It moves substances uphill,It requires carrier proteins,It occurs without a gradient,It is an active process,It requires carrier proteins,"<span style=""color:green""><b>[It requires carrier proteins]:</b> Correct, unlike simple diffusion, facilitated diffusion needs carrier proteins.</span><br><span style=""color:red""><b>[It requires energy (ATP)]:</b> Wrong, both simple and facilitated diffusion are passive.</span><br><span style=""color:red""><b>[It moves substances uphill]:</b> Wrong, both are downhill processes.</span><br><span style=""color:red""><b>[It occurs without a gradient]:</b> Wrong, both follow an electrochemical gradient.</span><br><span style=""color:red""><b>[It is an active process]:</b> Wrong, both are passive.</span>"
,,,,Cell Physiology (BRS),Membrane Transport,What is a specific example of facilitated diffusion mentioned in the text?,Na–K pump,Ca-ATPase,Na–Glucose transport,Glucose transport in muscle [MCQ],Na–Ca counter-transport,Glucose transport in muscle [MCQ],"<span style=""color:green""><b>[Glucose transport in muscle [MCQ]]:</b> Correct, the text specifically lists this as the example for facilitated diffusion.</span><br><span style=""color:red""><b>[Na–K pump]:</b> Wrong, this is primary active transport.</span><br><span style=""color:red""><b>[Ca-ATPase]:</b> Wrong, this is primary active transport.</span><br><span style=""color:red""><b>[Na–Glucose transport]:</b> Wrong, this is secondary active transport (co-transport).</span><br><span style=""color:red""><b>[Na–Ca counter-transport]:</b> Wrong, this is secondary active transport (antiport).</span>"
,,,,Cell Physiology (BRS),Membrane Transport,How does Primary Active Transport move substances?,Downhill without energy,Downhill with a carrier,Uphill against electrochemical gradient using ATP,Uphill using energy from another pump,Passive through a channel,Uphill against electrochemical gradient using ATP,"<span style=""color:green""><b>[Uphill against electrochemical gradient using ATP]:</b> Correct, the text states it moves uphill and needs energy (ATP).</span><br><span style=""color:red""><b>[Downhill without energy]:</b> Wrong, this describes simple diffusion.</span><br><span style=""color:red""><b>[Downhill with a carrier]:</b> Wrong, this describes facilitated diffusion.</span><br><span style=""color:red""><b>[Uphill using energy from another pump]:</b> Wrong, this describes secondary active transport.</span><br><span style=""color:red""><b>[Passive through a channel]:</b> Wrong, primary active transport is an active process.</span>"
,,,,Cell Physiology (BRS),Membrane Transport,Which of the following is an example of Primary Active Transport?,Glucose transport in muscle,Na–Glucose co-transport,Na–Ca counter-transport,Na–K pump (cell membrane),Simple diffusion,Na–K pump (cell membrane),"<span style=""color:green""><b>[Na–K pump (cell membrane)]:</b> Correct, the text lists this as a primary active transport example.</span><br><span style=""color:red""><b>[Glucose transport in muscle]:</b> Wrong, this is facilitated diffusion.</span><br><span style=""color:red""><b>[Na–Glucose co-transport]:</b> Wrong, this is secondary active transport.</span><br><span style=""color:red""><b>[Na–Ca counter-transport]:</b> Wrong, this is secondary active transport.</span><br><span style=""color:red""><b>[Simple diffusion]:</b> Wrong, this is a passive process.</span>"
,,,,Cell Physiology (BRS),Membrane Transport,Where is the Ca-ATPase pump located according to the text?,Cell membrane,Sarcoplasmic reticulum (SR),Mitochondria,Nucleus,Lysosome,Sarcoplasmic reticulum (SR),"<span style=""color:green""><b>[Sarcoplasmic reticulum (SR)]:</b> Correct, the text specifically places Ca-ATPase in the SR.</span><br><span style=""color:red""><b>[Cell membrane]:</b> Wrong, the text identifies the cell membrane as the location for the Na-K pump.</span><br><span style=""color:red""><b>[Mitochondria]:</b> Wrong, this location is not mentioned in the text.</span><br><span style=""color:red""><b>[Nucleus]:</b> Wrong, this location is not mentioned in the text.</span><br><span style=""color:red""><b>[Lysosome]:</b> Wrong, this location is not mentioned in the text.</span>"
,,,,Cell Physiology (BRS),Membrane Transport,Secondary active transport is characterized by:,Using ATP directly,Moving substances downhill,Using energy made by a primary pump to move uphill,Requiring no carrier protein,Being a passive process,Using energy made by a primary pump to move uphill,"<span style=""color:green""><b>[Using energy made by a primary pump to move uphill]:</b> Correct, secondary active transport uses energy generated by a primary pump to move uphill.</span><br><span style=""color:red""><b>[Using ATP directly]:</b> Wrong, this describes primary active transport.</span><br><span style=""color:red""><b>[Moving substances downhill]:</b> Wrong, secondary active transport moves substances uphill.</span><br><span style=""color:red""><b>[Requiring no carrier protein]:</b> Wrong, active transport typically involves carrier mechanisms.</span><br><span style=""color:red""><b>[Being a passive process]:</b> Wrong, it is an active process.</span>"
,,,,Cell Physiology (BRS),Membrane Transport,Which example represents co-transport (symport)?,Na–Ca exchange,Na–K pump,Glucose transport in muscle,Na–Glucose transport,Simple diffusion,Na–Glucose transport,"<span style=""color:green""><b>[Na–Glucose transport]:</b> Correct, the text defines this as co-transport (symport).</span><br><span style=""color:red""><b>[Na–Ca exchange]:</b> Wrong, this is defined as counter-transport (antiport).</span><br><span style=""color:red""><b>[Na–K pump]:</b> Wrong, this is primary active transport.</span><br><span style=""color:red""><b>[Glucose transport in muscle]:</b> Wrong, this is facilitated diffusion.</span><br><span style=""color:red""><b>[Simple diffusion]:</b> Wrong, this is a passive process.</span>"
,,,,Cell Physiology (BRS),Membrane Transport,"In counter-transport (antiport), how do substances move?",Both go together in the same direction,"One moves in, one moves out",Downhill without energy,Through simple diffusion,Only out of the cell,"One moves in, one moves out","<span style=""color:green""><b>[One moves in, one moves out]:</b> Correct, the text defines counter-transport (antiport) as one moving in and one moving out.</span><br><span style=""color:red""><b>[Both go together in the same direction]:</b> Wrong, this describes co-transport (symport).</span><br><span style=""color:red""><b>[Downhill without energy]:</b> Wrong, this describes diffusion.</span><br><span style=""color:red""><b>[Through simple diffusion]:</b> Wrong, antiport is active transport.</span><br><span style=""color:red""><b>[Only out of the cell]:</b> Wrong, it involves an exchange mechanism.</span>"
,,,,Cell Physiology (BRS),Membrane Potential,What is the standard resting membrane potential of a typical neuron?,-60mV,-70mV,-80mV,-90mV,-100mV,B,"<div style=""text-align: justify""><b><span style=""color:green"">-70mV</span></b><br>This value represents the stable electrical equilibrium for neurons, maintained primarily by the leak of potassium ions and the sodium-potassium pump.<br><br><b><span style=""color:red"">-60mV</span></b><br>This is too close to the firing threshold; a nerve at this potential would be hyper-excitable and unstable.<br><br><b><span style=""color:red"">-80mV</span></b><br>While some cells sit here, standard neurons require the specific metabolic balance that results in -70mV.<br><br><b><span style=""color:red"">-90mV</span></b><br>This higher negativity is characteristic of larger cells like skeletal muscles, which have different ion permeability profiles.<br><br><b><span style=""color:red"">-100mV</span></b><br>At this level, the cell would be so deeply inhibited that it would require a massive stimulus to ever reach an action potential.<br><br><center><b><span style=""color:goldenrod"">💡 Tip</span></b><br>Think of -70 as the ""base camp"" for nerve signals.</center></div>"
,,,,Cell Physiology (BRS),Membrane Potential,Which electrical potential is characteristic of a skeletal muscle fiber at rest?,-50mV,-70mV,-80mV,-90mV,-110mV,D,"<div style=""text-align: justify""><b><span style=""color:green"">-90mV</span></b><br>Muscle cells maintain this deeper negative potential to ensure that they only contract when receiving a strong, intentional signal.<br><br><b><span style=""color:red"">-50mV</span></b><br>This level indicates a cell that is actively depolarizing; it cannot be considered a ""resting"" state.<br><br><b><span style=""color:red"">-70mV</span></b><br>This is the specific voltage signature of a nerve cell, which operates at a different electrical baseline than muscle.<br><br><b><span style=""color:red"">-80mV</span></b><br>This value falls short of the full stabilization required for the metabolic and electrical demands of muscle tissue.<br><br><b><span style=""color:red"">-110mV</span></b><br>This is beyond the equilibrium potential of the ions involved, making it an unsustainable resting level for the cell.<br><br><center><b><span style=""color:goldenrod"">💡 Tip</span></b><br>Muscle is ""More"" negative because it's a ""Mightier"" battery.</center></div>"
,,,,Cell Physiology (BRS),Membrane Potential,Which sequence of events characterizes an Action Potential?,Static equilibrium,Rapid depolarization followed by repolarization,Constant hyperpolarization,Gradual leak of sodium ions,Permanent loss of membrane polarity,B,"<div style=""text-align: justify""><b><span style=""color:green"">Rapid depolarization followed by repolarization</span></b><br>This describes the complete ""spike"" where the cell voltage shoots up and then quickly recovers to its baseline.<br><br><b><span style=""color:red"">Static equilibrium</span></b><br>This describes a resting state where no signals are being sent, the exact opposite of an action potential.<br><br><b><span style=""color:red"">Constant hyperpolarization</span></b><br>This is a state of deep inhibition where the cell is made harder to fire, rather than a dynamic signal.<br><br><b><span style=""color:red"">Gradual leak of sodium ions</span></b><br>Leaks occur at rest but do not possess the speed or magnitude required to be classified as an action potential.<br><br><b><span style=""color:red"">Permanent loss of membrane polarity</span></b><br>A permanent loss would mean the cell has died; action potentials are temporary and fully reversible.<br><br><center><b><span style=""color:goldenrod"">💡 Tip</span></b><br>Action Potential = The wave. Depol is the peak, Repol is the crash.</center></div>"
,,,,Cell Physiology (BRS),Membrane Potential,What serves as the primary trigger for the opening of voltage-gated ion channels?,Chemical neurotransmitters,Binding of hormones,A shift in the membrane potential,Intracellular second messengers,External physical pressure,C,"<div style=""text-align: justify""><b><span style=""color:green"">A shift in the membrane potential</span></b><br>These channels contain voltage-sensing domains that change shape when the electrical field across the membrane alters.<br><br><b><span style=""color:red"">Chemical neurotransmitters</span></b><br>These act on ligand-gated receptors, which use chemical binding rather than electrical sensing to open.<br><br><b><span style=""color:red"">Binding of hormones</span></b><br>Hormones are ligands that typically initiate slow metabolic changes or open ligand-gated channels.<br><br><b><span style=""color:red"">Intracellular second messengers</span></b><br>While they can modulate channels, they are chemical signals within the cell, not the primary ""voltage"" trigger.<br><br><b><span style=""color:red"">External physical pressure</span></b><br>Mechanical force triggers mechanoreceptors, which is a different class of channel gated by physical tension.<br><br><center><b><span style=""color:goldenrod"">💡 Tip</span></b><br>Voltage-gated = Electric-sensing. It reacts to the ""Shock"" of voltage change.</center></div>"
,,,,Cell Physiology (BRS),Membrane Potential,Ligand-gated channels are primarily regulated by which of the following?,Temperature changes,Changes in voltage,Mechanical stretch,Hormones and neurotransmitters,Magnetic fields,D,"<div style=""text-align: justify""><b><span style=""color:green"">Hormones and neurotransmitters</span></b><br>These chemical ""ligands"" bind to specific receptor sites on the channel protein to induce a conformational change.<br><br><b><span style=""color:red"">Temperature changes</span></b><br>Thermal energy affects thermoreceptors (like TRP channels), but ""ligand-gated"" refers specifically to chemical triggers.<br><br><b><span style=""color:red"">Changes in voltage</span></b><br>This is the domain of voltage-gated channels, which ignore chemicals in favor of electrical charges.<br><br><b><span style=""color:red"">Mechanical stretch</span></b><br>This gating mechanism responds to the physical pulling of the cell membrane, not the binding of a molecule.<br><br><b><span style=""color:red"">Magnetic fields</span></b><br>Biological membranes are generally not gated by magnetic fields in standard human neurophysiology.<br><br><center><b><span style=""color:goldenrod"">💡 Tip</span></b><br>A Ligand is like a ""Hand"" (Hormone/Neurotransmitter) turning a doorknob.</center></div>"
,,,,Cell Physiology (BRS),Membrane Potential,Which ion has the highest permeability across a nerve membrane during its resting state?,Na+,Ca2+,K+,Cl-,H+,C,"<div style=""text-align: justify""><b><span style=""color:green"">K+</span></b><br>Potassium ""leak"" channels are mostly open at rest, allowing K+ to move freely and dominate the resting voltage.<br><br><b><span style=""color:red"">Na+</span></b><br>Sodium channels are tightly closed at rest; if they weren't, the cell would constantly fire and eventually die from exhaustion.<br><br><b><span style=""color:red"">Ca2+</span></b><br>Calcium is kept at extremely low concentrations inside the cell and is primarily used for signaling, not maintaining the resting baseline.<br><br><b><span style=""color:red"">Cl-</span></b><br>While chloride does contribute, its permeability in neurons is significantly lower than that of potassium.<br><br><b><span style=""color:red"">H+</span></b><br>Hydrogen ions relate to pH balance and do not serve as the primary ion for determining resting potential.<br><br><center><b><span style=""color:goldenrod"">💡 Tip</span></b><br>K+ is the ""King"" of the resting state because it has the most ""Keys"" (open channels).</center></div>"
,,,,Cell Physiology (BRS),Membrane Potential,How is depolarization characterized regarding membrane potential?,Potential becomes more negative,Potential remains static,Potential becomes less negative,Potential reaches zero exactly,Potential becomes highly positive only,C,"<div style=""text-align: justify""><b><span style=""color:green"">Potential becomes less negative</span></b><br>When positive ions (like Na+) enter the cell, they cancel out the internal negativity, moving the ""needle"" toward zero.<br><br><b><span style=""color:red"">Potential becomes more negative</span></b><br>This describes hyperpolarization, where the cell becomes even more ""polarized"" away from zero.<br><br><b><span style=""color:red"">Potential remains static</span></b><br>A static potential means no ions are shifting net charge, which is the definition of a stable resting state.<br><br><b><span style=""color:red"">Potential reaches zero exactly</span></b><br>While the potential passes through zero, depolarization describes the *direction* of the movement, not just a single point.<br><br><b><span style=""color:red"">Potential becomes highly positive only</span></b><br>Depolarization starts the moment the charge becomes even slightly less negative than -70mV, long before it hits positive territory.<br><br><center><b><span style=""color:goldenrod"">💡 Tip</span></b><br>Depolarization = ""Destroying"" the negative pole.</center></div>"
,,,,Cell Physiology (BRS),Membrane Potential,What is the direct result of hyperpolarization on a cell membrane?,It becomes easier to excite,It becomes more negative,It hits the threshold faster,It becomes more positive,It loses its permeability to K+,B,"<div style=""text-align: justify""><b><span style=""color:green"">It becomes more negative</span></b><br>This occurs when extra positive charge leaves (K+) or negative charge enters (Cl-), making the cell harder to excite.<br><br><b><span style=""color:red"">It becomes less negative</span></b><br>This is the definition of depolarization, which makes the cell more likely to fire an action potential.<br><br><b><span style=""color:red"">It stays at -70mV</span></b><br>This is the normal resting level; ""hyper"" implies going beyond the normal negative state.<br><br><b><span style=""color:red"">It becomes zero</span></b><br>Zero represents a complete loss of polarity, whereas hyperpolarization is an increase in the negative polarity.<br><br><b><span style=""color:red"">It becomes positive</span></b><br>A positive interior is the result of massive sodium influx during the peak of an action potential, not hyperpolarization.<br><br><center><b><span style=""color:goldenrod"">💡 Tip</span></b><br>Hyperpolarization is like ""Super-cooling"" the cell's excitement.</center></div>"
,,,,Cell Physiology (BRS),Membrane Potential,Which pharmacological agents specifically block voltage-sensitive Na+ channels?,TEA,Digitalis,Lidocaine and Tetrodotoxin (TTX),Acetylcholine,Calcium Gluconate,C,"<div style=""text-align: justify""><b><span style=""color:green"">Lidocaine and Tetrodotoxin (TTX)</span></b><br>These molecules act as physical ""plugs"" for the sodium channel pore, preventing the influx of Na+ and stopping the nerve signal.<br><br><b><span style=""color:red"">TEA</span></b><br>This compound is a selective inhibitor of potassium channels, meaning it affects the ""falling"" phase of the signal rather than the ""rising"" phase.<br><br><b><span style=""color:red"">Digitalis</span></b><br>This drug inhibits the Sodium-Potassium pump, which is a slow active transporter, not a fast voltage-gated channel.<br><br><b><span style=""color:red"">Acetylcholine</span></b><br>This is a neurotransmitter that usually *opens* ligand-gated channels rather than blocking voltage-gated sodium channels.<br><br><b><span style=""color:red"">Calcium Gluconate</span></b><br>This is a supplement used to stabilize membranes or treat electrolyte imbalances, not a specific Na+ channel blocker.<br><br><center><b><span style=""color:goldenrod"">💡 Tip</span></b><br>Lidocaine and TTX ""Tame"" the Sodium rush.</center></div>"
,,,,Cell Physiology (BRS),Membrane Potential,What is the primary action of Tetraethylammonium (TEA) on excitable membranes?,It blocks Na+ influx,It activates the Na+/K+ pump,It blocks voltage-gated K+ channels,It opens Cl- channels,It mimics the effect of Lidocaine,C,"<div style=""text-align: justify""><b><span style=""color:green"">It blocks voltage-gated K+ channels</span></b><br>By inhibiting these channels, TEA prevents potassium from leaving the cell, which significantly delays the repolarization phase of the action potential.<br><br><b><span style=""color:red"">It blocks Na+ influx</span></b><br>Sodium blocking is the mechanism used by Lidocaine and TTX, whereas TEA targets the potassium current.<br><br><b><span style=""color:red"">It activates the Na+/K+ pump</span></b><br>TEA is an inhibitor of ion channels, not an activator of metabolic pumps.<br><br><b><span style=""color:red"">It opens Cl- channels</span></b><br>There is no physiological evidence that TEA acts as a chloride channel opener.<br><br><b><span style=""color:red"">It mimics the effect of Lidocaine</span></b><br>Lidocaine stops the ""upstroke"" (Na+), whereas TEA stops the ""downstroke"" (K+); they have opposite effects on the signal shape.<br><br><center><b><span style=""color:goldenrod"">💡 Tip</span></b><br>TEA = <b>T</b>erminate <b>E</b>xit of <b>A</b>tom (Potassium).</center></div>"
,,,,Cell Physiology (BRS),Membrane Potential,"During depolarization, what occurs to the activation gates of Na+ channels?",They close slowly,They open rapidly,They become permanently blocked,They allow potassium to exit,They move to a hyperpolarized state,B,"<div style=""text-align: justify""><b><span style=""color:green"">They open rapidly</span></b><br>The positive shift in voltage causes the ""m-gates"" to swing open instantly, allowing the rapid upstroke of the action potential.<br><br><b><span style=""color:red"">They close slowly</span></b><br>The *inactivation* gates close slowly, but the *activation* gates mentioned here must open to start the signal.<br><br><b><span style=""color:red"">They become permanently blocked</span></b><br>The gating process is a dynamic, functional cycle, not a permanent blockage.<br><br><b><span style=""color:red"">They allow potassium to exit</span></b><br>Sodium channels are highly selective for Na+; they do not facilitate the movement of potassium.<br><br><b><span style=""color:red"">They move to a hyperpolarized state</span></b><br>Depolarization is the trigger for the gates; hyperpolarization is a voltage state that typically resets them.<br><br><center><b><span style=""color:goldenrod"">💡 Tip</span></b><br>Depolarization is the ""Go"" signal for the Sodium gates.</center></div>"
,,,,Cell Physiology (BRS),Neuromuscular Transmission,Which neurotransmitter is primarily released from the presynaptic terminal at the neuromuscular junction?,Norepinephrine,Dopamine,Acetylcholine (ACh),Serotonin,GABA,C,"<div style=""text-align: justify""><b><span style=""color:green"">Acetylcholine (ACh)</span></b><br>This molecule is the universal signal at the neuromuscular junction, crossing the synaptic cleft to initiate muscle contraction.<br><br><b><span style=""color:red"">Norepinephrine</span></b><br>While vital for the sympathetic nervous system, this neurotransmitter is not used to signal voluntary muscle fibers at the NMJ.<br><br><b><span style=""color:red"">Dopamine</span></b><br>Dopamine is primarily involved in reward and motor control within the central nervous system, not the peripheral motor terminal.<br><br><b><span style=""color:red"">Serotonin</span></b><br>Serotonin acts largely within the brainstem and gut to regulate mood and motility, rather than direct muscle fiber activation.<br><br><b><span style=""color:red"">GABA</span></b><br>GABA is an inhibitory neurotransmitter of the central nervous system and would not be used to trigger an excitatory muscle response.<br><br><center><b><span style=""color:goldenrod"">💡 Tip</span></b><br>ACh = ""Always Causes Hops"" (Muscle movement).</center></div>"
