Book,Exam,Number,ID,Subject,Topic,Question,OptionA,OptionB,OptionC,OptionD,OptionE,CorrectAnswer,Explanation
,,,,Endocrine Physiology (BRS),Thyroid Gland,Which of the following metabolic effects is stimulated by thyroid hormones?,Glycogen synthesis,Glucose oxidation,Reduced gluconeogenesis,Lipid storage,Protein synthesis inhibition,B,"<div style=""text-align: justify""><b><span style=""color:green"">Glucose oxidation</span></b><br>Thyroid hormones increase the body's metabolic rate by promoting the breakdown and ""burning"" (oxidation) of glucose to produce energy.<br><br><b><span style=""color:red"">Glycogen synthesis</span></b><br>Thyroid hormones promote glycogenolysis (breakdown of glycogen), not the storage (synthesis) of glycogen.<br><br><b><span style=""color:red"">Reduced gluconeogenesis</span></b><br>Thyroid hormones actually *increase* gluconeogenesis to ensure there is enough blood sugar available to meet the high metabolic demand.<br><br><b><span style=""color:red"">Lipid storage</span></b><br>Thyroid hormones are catabolic toward fats, meaning they increase lipolysis (fat breakdown) rather than promoting storage.<br><br><b><span style=""color:red"">Protein synthesis inhibition</span></b><br>While excess hormone can cause protein breakdown, the net metabolic goal of thyroid hormone is to coordinate energetic processes, not specifically to inhibit protein production.<br><br><center><b><span style=""color:goldenrod"">💡 Tip</span></b><br>Thyroid ""Burns"" fuel (Increased oxidation).</center></div>"
,,,,Endocrine Physiology (BRS),Adrenal Gland,Which layer of the adrenal cortex is exclusively responsible for the production of Aldosterone?,Zona Fasciculata,Zona Reticularis,Zona Glomerulosa,Adrenal Medulla,Chromaffin cells,C,"<div style=""text-align: justify""><b><span style=""color:green"">Zona Glomerulosa</span></b><br>The outermost layer of the cortex contains the enzyme aldosterone synthase, making it the only site capable of producing mineralocorticoids like aldosterone.<br><br><b><span style=""color:red"">Zona Fasciculata</span></b><br>This middle layer is primarily responsible for the secretion of glucocorticoids, such as cortisol, in response to ACTH.<br><br><b><span style=""color:red"">Zona Reticularis</span></b><br>The innermost cortical layer focuses on the production of adrenal androgens like DHEA rather than aldosterone.<br><br><b><span style=""color:red"">Adrenal Medulla</span></b><br>The medulla is the core of the gland and secretes catecholamines (epinephrine and norepinephrine), not steroid hormones.<br><br><b><span style=""color:red"">Chromaffin cells</span></b><br>These are the specialized cells of the medulla; they do not possess the machinery required to synthesize steroid hormones.<br><br><center><b><span style=""color:goldenrod"">💡 Tip</span></b><br>Remember ""GFR"": Glomerulosa (Salt), Fasciculata (Sugar), Reticularis (Sex).</center></div>"
,,,,Endocrine Physiology (BRS),Adrenal Gland,"Steroids such as Progesterone, Cortisol, and Aldosterone share which common carbon structure?",17-Carbon structure,18-Carbon structure,19-Carbon structure,21-Carbon structure,27-Carbon structure,D,"<div style=""text-align: justify""><b><span style=""color:green"">21-Carbon structure</span></b><br>Progestogens, glucocorticoids, and mineralocorticoids are all 21-carbon steroids derived from the same early steps of the steroidogenesis pathway.<br><br><b><span style=""color:red"">18-Carbon structure</span></b><br>This structure is characteristic of estrogens; these molecules have lost more carbon atoms during their synthesis from androgens.<br><br><b><span style=""color:red"">19-Carbon structure</span></b><br>This structure defines the androgens (like testosterone); they have more carbons than estrogens but fewer than cortisol or aldosterone.<br><br><b><span style=""color:red"">17-Carbon structure</span></b><br>While the steroid nucleus has 17 carbons in its four-ring core, the classification of these hormones depends on the extra carbons in the side chains.<br><br><b><span style=""color:red"">27-Carbon structure</span></b><br>This is the structure of Cholesterol, the ""mother molecule"" before it is cleaved into the smaller steroid hormone variants.<br><br><center><b><span style=""color:goldenrod"">💡 Tip</span></b><br>The ""Big Three"" (Progest/Cort/Aldo) have the most carbons (21).</center></div>"
,,,,Endocrine Physiology (BRS),Adrenal Gland,At what time of day are cortisol levels typically at their highest point?,Mid-afternoon,Late evening (at sleep onset),Just before waking,Exactly at midnight,During the lunch hour,C,"<div style=""text-align: justify""><b><span style=""color:green"">Just before waking</span></b><br>Glucocorticoid secretion follows a strict circadian rhythm, peaking in the early morning to prepare the body for the metabolic demands of the day.<br><br><b><span style=""color:red"">Mid-afternoon</span></b><br>Cortisol levels begin a steady decline after the morning peak and are significantly lower by the afternoon.<br><br><b><span style=""color:red"">Late evening (at sleep onset)</span></b><br>Cortisol is naturally low in the evening to allow for rest; elevated levels at this time are often a sign of chronic stress.<br><br><b><span style=""color:red"">Exactly at midnight</span></b><br>This is generally the nadir (lowest point) of cortisol secretion in a person with a normal sleep-wake cycle.<br><br><b><span style=""color:red"">During the lunch hour</span></b><br>While levels may spike slightly due to stress or food, the physiological circadian peak occurs much earlier in the morning.<br><br><center><b><span style=""color:goldenrod"">💡 Tip</span></b><br>Cortisol is your ""internal alarm clock""—it peaks to wake you up.</center></div>"
,,,,Endocrine Physiology (BRS),Adrenal Gland,Which metabolic process is primarily stimulated by the action of Glucocorticoids?,Glycogen synthesis,Gluconeogenesis,Glucose oxidation,Protein storage,Lipid synthesis,B,"<div style=""text-align: justify""><b><span style=""color:green"">Gluconeogenesis</span></b><br>Cortisol stimulates the liver to produce ""new"" glucose from non-carbohydrate sources like amino acids to maintain blood sugar during stress.<br><br><b><span style=""color:red"">Glycogen synthesis</span></b><br>Glucocorticoids generally promote the breakdown or mobilization of energy rather than the storage of glycogen.<br><br><b><span style=""color:red"">Glucose oxidation</span></b><br>Increased glucose oxidation (burning sugar) is a thyroid hormone effect; cortisol focuses on raising blood glucose levels.<br><br><b><span style=""color:red"">Protein storage</span></b><br>Cortisol is catabolic to protein in muscle and skin, breaking it down into amino acids for use in gluconeogenesis.<br><br><b><span style=""color:red"">Lipid synthesis</span></b><br>While cortisol affects fat distribution, its primary metabolic ""Sugar"" role is the active production of glucose.<br><br><center><b><span style=""color:goldenrod"">💡 Tip</span></b><br>Glucocorticoid = ""Gluco"" (Glucose) + ""Neo"" (New) + ""Genesis"" (Creation).</center></div>"
,,,,Endocrine Physiology (BRS),Adrenal Gland,What is the direct effect of Aldosterone on the renal handling of potassium and hydrogen?,Increased reabsorption of both,Decreased secretion of both,Increased secretion of both,Increased K+ reabsorption and H+ secretion,Increased K+ secretion and H+ reabsorption,C,"<div style=""text-align: justify""><b><span style=""color:green"">Increased secretion of both</span></b><br>Aldosterone acts on the principal and intercalated cells to dump K+ and H+ into the urine in exchange for reclaiming sodium.<br><br><b><span style=""color:red"">Increased reabsorption of both</span></b><br>This would lead to hyperkalemia and acidosis, which is the exact opposite of what aldosterone is designed to achieve.<br><br><b><span style=""color:red"">Decreased secretion of both</span></b><br>Aldosterone actively drives the secretion of these ions; a lack of aldosterone (Addison's) would lead to decreased secretion.<br><br><b><span style=""color:red"">Increased K+ reabsorption and H+ secretion</span></b><br>While it does secrete H+, it never reabsorbs K+; it is the body's primary way of getting rid of excess potassium.<br><br><b><span style=""color:red"">Increased K+ secretion and H+ reabsorption</span></b><br>Reabsorbing H+ would make the blood acidic; aldosterone helps ""wash out"" acid to maintain a healthy pH.<br><br><center><b><span style=""color:goldenrod"">💡 Tip</span></b><br>Aldosterone ""S""aves ""S""odium and ""S""pends (Secretes) K+ and H+.</center></div>"
,,,,Endocrine Physiology (BRS),Pancreas,What is the primary physiological factor regulating the secretion of Glucagon from the pancreatic alpha cells?,Blood calcium levels,Blood glucose concentration,Plasma protein levels,Insulin concentration only,Circadian rhythm,B,"<div style=""text-align: justify""><b><span style=""color:green"">Blood glucose concentration</span></b><br>The alpha cells are acutely sensitive to a drop in blood sugar; when glucose falls, glucagon is released to mobilize energy stores from the liver.<br><br><b><span style=""color:red"">Blood calcium levels</span></b><br>Calcium levels regulate the parathyroid gland, but they are not the primary trigger for the metabolic hormones of the endocrine pancreas.<br><br><b><span style=""color:red"">Plasma protein levels</span></b><br>While amino acids can influence glucagon, the dominant and most critical regulator of its secretion is the concentration of glucose.<br><br><b><span style=""color:red"">Insulin concentration only</span></b><br>While insulin can inhibit glucagon, the alpha cell primarily responds to the glucose level itself as its chief regulatory signal.<br><br><b><span style=""color:red"">Circadian rhythm</span></b><br>Unlike cortisol, glucagon is not driven by a strict time-of-day cycle; it is a ""reactive"" hormone that responds to the body's immediate nutritional state.<br><br><center><b><span style=""color:goldenrod"">💡 Tip</span></b><br>Glucagon is ""G""one when ""G""lucose is high.</center></div>"
,,,,Endocrine Physiology (BRS),Pancreas,Which of the following metabolic outcomes is a direct result of Glucagon activity?,Decreased blood glucose,Increased urea production,Inhibition of ketoacidosis,Lipid storage,Protein synthesis promotion,B,"<div style=""text-align: justify""><b><span style=""color:green"">Increased urea production</span></b><br>Glucagon promotes the breakdown of amino acids to fuel gluconeogenesis, which increases the production of urea as a byproduct of nitrogen metabolism.<br><br><b><span style=""color:red"">Decreased blood glucose</span></b><br>The central purpose of glucagon is to *increase* blood glucose during states of fasting or hypoglycemia.<br><br><b><span style=""color:red"">Inhibition of ketoacidosis</span></b><br>Glucagon actually stimulates the production of ketoacids (ketogenesis) by directing fatty acids toward oxidation in the liver.<br><br><b><span style=""color:red"">Lipid storage</span></b><br>Glucagon is a catabolic hormone that promotes the breakdown of fats (lipolysis) rather than their storage.<br><br><b><span style=""color:red"">Protein synthesis promotion</span></b><br>Glucagon favors protein breakdown (catabolism) to provide amino acids for glucose production, the opposite of an anabolic synthesis effect.<br><br><center><b><span style=""color:goldenrod"">💡 Tip</span></b><br>Glucagon ""G""enerates ""G""lucose and ""U""rea.</center></div>"
,,,,Endocrine Physiology (BRS),Pancreas,The secretion of Insulin from pancreatic beta cells is most powerfully stimulated by which factor?,Exercise,Fasting,Glucose concentration,Somatostatin,Norepinephrine,C,"<div style=""text-align: justify""><b><span style=""color:green"">Glucose concentration</span></b><br>When blood sugar rises after a meal, it enters the beta cells and triggers a cascade that leads to the rapid release of stored insulin.<br><br><b><span style=""color:red"">Exercise</span></b><br>During intense exercise, insulin secretion is actually inhibited by the sympathetic nervous system to ensure glucose remains available in the blood for muscles.<br><br><b><span style=""color:red"">Fasting</span></b><br>Fasting leads to a drop in insulin levels, as there is no need to store glucose when the body is trying to maintain its baseline blood sugar.<br><br><b><span style=""color:red"">Somatostatin</span></b><br>Somatostatin is a universal inhibitor that shuts down the secretion of both insulin and glucagon.<br><br><b><span style=""color:red"">Norepinephrine</span></b><br>Norepinephrine (sympathetic drive) typically inhibits insulin release to prevent blood sugar from dropping during a ""fight or flight"" response.<br><br><center><b><span style=""color:goldenrod"">💡 Tip</span></b><br>Insulin is the ""I""ncoming signal for ""I""ngested sugar.</center></div>"
,,,,Endocrine Physiology (BRS),Pancreas,Which statement best describes the relationship between the physiological actions of Insulin and Glucagon?,They are synergistic,They have identical metabolic targets,They are opposite to each other,Insulin stimulates glucagon release,They only act on the skeletal muscles,C,"<div style=""text-align: justify""><b><span style=""color:green"">They are opposite to each other</span></b><br>Insulin is anabolic and promotes storage (lowers blood sugar), while glucagon is catabolic and promotes mobilization (raises blood sugar).<br><br><b><span style=""color:red"">They are synergistic</span></b><br>Synergistic hormones work together toward the same goal; insulin and glucagon work in opposition to maintain glucose homeostasis.<br><br><b><span style=""color:red"">They have identical metabolic targets</span></b><br>While they both act on the liver, their specific effects on the enzymes of glycolysis and gluconeogenesis are diametrically opposed.<br><br><b><span style=""color:red"">Insulin stimulates glucagon release</span></b><br>Insulin actually exerts a paracrine inhibitory effect on the alpha cells, meaning it *decreases* the secretion of glucagon.<br><br><b><span style=""color:red"">They only act on the skeletal muscles</span></b><br>Their primary site of ""battle"" for glucose regulation is the liver, though insulin has widespread effects on muscle and adipose tissue as well.<br><br><center><b><span style=""color:goldenrod"">💡 Tip</span></b><br>Think of them as a ""See-Saw""—one goes up, the other must go down.</center></div>"
,,,,,,,,,,,,,
,,,,"Respiratory Physiology
(First Aid)",Lung Development,"At what gestational week does the lung bud first appear, marking the beginning of lung development?",2 weeks,4 weeks,8 weeks,12 weeks,16 weeks,B,"<div style=""text-align: justify""><b><span style=""color:green"">4 weeks</span></b><br>The respiratory diverticulum (lung bud) appears at week 4, branching from the foregut to eventually form the trachea and bronchial tree.<br><br><b><span style=""color:red"">2 weeks</span></b><br>At week 2, the embryo is still in the bilaminar disc stage; organogenesis of the respiratory system has not yet begun.<br><br><b><span style=""color:red"">8 weeks</span></b><br>By week 8, the embryonic stage is ending and the segmental bronchi have already formed; the initiation occurred much earlier.<br><br><b><span style=""color:red"">12 weeks</span></b><br>Week 12 is well into the pseudoglandular stage, where terminal bronchioles are forming, far past the initial lung bud stage.<br><br><b><span style=""color:red"">16 weeks</span></b><br>At week 16, the lungs are entering the canalicular stage; the initial development began 12 weeks prior.<br><br><center><b><span style=""color:goldenrod"">💡 Tip</span></b><br>Lung development ""Starts at Four"" (4 weeks).</center></div>"
,,,,"Respiratory Physiology
(First Aid)",Lung Development,During which stage of lung development does the fetus first become capable of respiration?,Embryonic stage,Pseudoglandular stage,Canalicular stage,Saccular stage,Alveolar stage,C,"<div style=""text-align: justify""><b><span style=""color:green"">Canalicular stage</span></b><br>By the end of this stage (week 25), respiratory bronchioles and alveolar ducts have formed, allowing for minimal gas exchange if the infant is born prematurely.<br><br><b><span style=""color:red"">Embryonic stage</span></b><br>This stage focuses on the formation of the trachea and major bronchi; no structures for gas exchange exist yet.<br><br><b><span style=""color:red"">Pseudoglandular stage</span></b><br>During this phase, only terminal bronchioles exist; respiration is impossible and incompatible with life.<br><br><b><span style=""color:red"">Saccular stage</span></b><br>While respiration is certainly possible here, the *earliest* capability is established during the preceding canalicular stage.<br><br><b><span style=""color:red"">Alveolar stage</span></b><br>This is the final stage of maturation where true alveoli form; it occurs late in pregnancy and continues after birth.<br><br><center><b><span style=""color:goldenrod"">💡 Tip</span></b><br>Canalicular = ""C""apable of breathing (at week 25).</center></div>"
,,,,"Respiratory Physiology
(First Aid)",Lung Development,Which pneumocyte type is squamous in shape and covers approximately 97% of the alveolar surface?,Type II Pneumocyte,Alveolar Macrophage,Type I Pneumocyte,Goblet Cell,Clara Cell,C,"<div style=""text-align: justify""><b><span style=""color:green"">Type I Pneumocyte</span></b><br>These thin, squamous cells provide the vast surface area required for efficient gas diffusion between the air and the blood.<br><br><b><span style=""color:red"">Type II Pneumocyte</span></b><br>These are cuboidal cells that secrete surfactant; they are more numerous than Type I cells but cover only about 3% of the surface.<br><br><b><span style=""color:red"">Alveolar Macrophage</span></b><br>These are immune cells that ""clean"" the alveoli; they do not form the structural lining of the alveolar wall.<br><br><b><span style=""color:red"">Goblet Cell</span></b><br>Goblet cells are found in the conducting airways where they secrete mucus; they are not found in the gas-exchange alveoli.<br><br><b><span style=""color:red"">Clara Cell</span></b><br>Also known as Club cells, these are found in bronchioles and secrete protective substances, but they do not line the alveoli.<br><br><center><b><span style=""color:goldenrod"">💡 Tip</span></b><br>Type ""I"" is for ""I""nterchange (Gas exchange surface).</center></div>"
,,,,"Respiratory Physiology
(First Aid)",Lung Development,Pulmonary hypoplasia is classically associated with which developmental sequence?,Down syndrome,Potter sequence,DiGeorge syndrome,VACTERL association,Turner syndrome,B,"<div style=""text-align: justify""><b><span style=""color:green"">Potter sequence</span></b><br>Potter sequence results from oligohydramnios (low amniotic fluid); without the fluid for the fetus to ""breathe"" in utero, the lungs fail to develop properly.<br><br><b><span style=""color:red"">Down syndrome</span></b><br>While associated with various structural anomalies, Down syndrome is not the primary cause of the specific sequence leading to pulmonary hypoplasia.<br><br><b><span style=""color:red"">DiGeorge syndrome</span></b><br>This is a 22q11 deletion affecting the thymus and parathyroids, rather than causing primary pulmonary hypoplasia via oligohydramnios.<br><br><b><span style=""color:red"">VACTERL association</span></b><br>VACTERL includes vertebral and tracheoesophageal defects, but Potter sequence is the specific association for hypoplastic lungs due to fluid issues.<br><br><b><span style=""color:red"">Turner syndrome</span></b><br>Turner syndrome (45,X) often involves a webbed neck and heart defects, but not typically the lung hypoplasia seen in Potter sequence.<br><br><center><b><span style=""color:goldenrod"">💡 Tip</span></b><br>""P""otter = ""P""ulmonology problem (Hypoplasia).</center></div>"
,,,,"Respiratory Physiology
(First Aid)",Lung Development,"Which stage of lung development is characterized by the mnemonic ""Every Pulmonologist Can See Alveoli""?",Saccular,Alveolar,Embryonic through Alveolar,Pseudoglandular only,Canalicular only,C,"<div style=""text-align: justify""><b><span style=""color:green"">Embryonic through Alveolar</span></b><br>This mnemonic represents the chronological order: **E**mbryonic, **P**seudoglandular, **C**analicular, **S**accular, and **A**lveolar stages.<br><br><b><span style=""color:red"">Saccular</span></b><br>This is only the fourth stage (the ""See"" in the mnemonic); it does not encompass the entire developmental sequence.<br><br><b><span style=""color:red"">Alveolar</span></b><br>This is the final stage (the ""Alveoli"" in the mnemonic) where terminal sacs turn into adult alveoli.<br><br><b><span style=""color:red"">Pseudoglandular only</span></b><br>This is the second stage (the ""Pulmonologist"" in the mnemonic), occurring between weeks 5 and 17.<br><br><b><span style=""color:red"">Canalicular only</span></b><br>This is the third stage (the ""Can"" in the mnemonic), marking the development of the capillary network.<br><br><center><b><span style=""color:goldenrod"">💡 Tip</span></b><br><b>E</b>very <b>P</b>ulmonologist <b>C</b>an <b>S</b>ee <b>A</b>lveoli.</center></div>"
,,,,"Respiratory Physiology
(First Aid)",Lung Development,Errors during the Embryonic stage (weeks 4-7) are most likely to result in which malformation?,Tracheoesophageal fistula,Neonatal RDS,Pulmonary edema,Pneumothorax,Alveolar collapse,A,"<div style=""text-align: justify""><b><span style=""color:green"">Tracheoesophageal fistula</span></b><br>Because the lung bud is separating from the foregut during the embryonic stage, errors in septation often lead to fistulas or atresia.<br><br><b><span style=""color:red"">Neonatal RDS</span></b><br>RDS is caused by surfactant deficiency, which is a functional issue of Type II pneumocytes appearing much later in development.<br><br><b><span style=""color:red"">Pulmonary edema</span></b><br>This is an accumulation of fluid in the lungs, typically a postnatal hemodynamic issue rather than an embryonic developmental error.<br><br><b><span style=""color:red"">Pneumothorax</span></b><br>This is a clinical event where air enters the pleural space, not a congenital malformation resulting from embryonic stage errors.<br><br><b><span style=""color:red"">Alveolar collapse</span></b><br>Alveoli don't even begin to form until the saccular and alveolar stages; embryonic errors affect much larger, central structures.<br><br><center><b><span style=""color:goldenrod"">💡 Tip</span></b><br>Early stage = Large tube errors (Trachea/Esophagus).</center></div>"
,,,,"Respiratory Physiology
(First Aid)",Lung Development,"In the Alveolar stage (Week 36 to 8 years), what is the primary mechanism for the formation of adult alveoli?",Endodermal tubule formation,Capillary budding,Secondary septation,Aspiration of amniotic fluid,Loss of pneumocytes,C,"<div style=""text-align: justify""><b><span style=""color:green"">Secondary septation</span></b><br>Adult alveoli are formed when terminal sacs are further divided by secondary septae, greatly increasing the surface area for gas exchange.<br><br><b><span style=""color:red"">Endodermal tubule formation</span></b><br>This occurs much earlier during the pseudoglandular stage and leads to terminal bronchioles, not alveoli.<br><br><b><span style=""color:red"">Capillary budding</span></b><br>While angiogenesis is necessary, the defining structural change that creates adult alveoli is the septation of the sacs.<br><br><b><span style=""color:red"">Aspiration of amniotic fluid</span></b><br>Aspiration of fluid is a fetal behavior that helps *expand* the lungs, but it is not the structural mechanism of septation.<br><br><b><span style=""color:red"">Loss of pneumocytes</span></b><br>Alveolar development requires the *differentiation* and growth of pneumocytes, not their loss.<br><br><center><b><span style=""color:goldenrod"">💡 Tip</span></b><br>Alveolar stage = ""S""econdary ""S""eptation.</center></div>"
,,,,"Respiratory Physiology
(First Aid)",Lung Development,"At what gestational age does the lung bud first appear, marking the start of the Embryonic stage?",Week 2,Week 4,Week 6,Week 8,,B,"<div style=""text-align: justify""><b><span style=""color:red"">Week 2</span></b><br>At week 2, the embryo is still in the bilaminar disc stage, which is too early for respiratory diverticulum formation.<br><br><b><span style=""color:green"">Week 4</span></b><br>The lung bud emerges from the ventral wall of the foregut precisely at week 4.<br><br><b><span style=""color:red"">Week 6</span></b><br>By week 6, the initial lung bud has already begun branching into the secondary (lobar) bronchi.<br><br><b><span style=""color:red"">Week 8</span></b><br>Week 8 marks the end of the embryonic stage, where the major segments are already established.<br><br><center><b><span style=""color:goldenrod"">💡 Tip</span></b><br>Lung development 'Starts at Four' (4 weeks).</center></div>"
